{"$schema":"https://json-schema.org/draft/2020-12/schema","$id":"https://kaveep.dev/dev-agent/schemas/engineering-brain-result.schema.json","title":"KAVEEP DEV-AGENT Engineering Brain Result","type":"object","required":["brainResultId","schemaVersion","brainRequestRef","providerId","model","status","proposal","warnings","errors","limitations","usage","startedAt","completedAt","recommendedNextAction"],"properties":{"brainResultId":{"type":"string","pattern":"^brain_result_[A-Za-z0-9][A-Za-z0-9_-]*$"},"schemaVersion":{"type":"string","const":"1.0.0"},"brainRequestRef":{"type":"string","pattern":"^brain_request_[A-Za-z0-9][A-Za-z0-9_-]*$"},"providerId":{"type":"string","pattern":"^[a-z][a-z0-9_-]*$"},"model":{"type":"string","minLength":1},"status":{"type":"string","enum":["completed","blocked","failed"]},"proposal":{"type":["object","null"]},"warnings":{"type":"array","items":{"type":"string"}},"errors":{"type":"array","items":{"type":"string"}},"limitations":{"type":"array","items":{"type":"string"}},"usage":{"type":"object","required":["inputTokens","outputTokens"],"properties":{"inputTokens":{"type":"integer","minimum":0},"outputTokens":{"type":"integer","minimum":0}},"additionalProperties":false},"startedAt":{"type":"string","format":"date-time"},"completedAt":{"type":"string","format":"date-time"},"recommendedNextAction":{"type":"string","enum":["review_proposal","gather_more_context","block_request","retry_provider"]}},"additionalProperties":false}
