{"brainResultId":"brain_result_example_001","schemaVersion":"1.0.0","brainRequestRef":"brain_request_example_001","providerId":"mock","model":"mock-engineering-model","status":"completed","proposal":{"proposalId":"engineering_proposal_example_001","schemaVersion":"1.0.0","requestRef":"request_example_001","planRef":"plan_example_001","contextRef":"context_example_001","objective":"Add a validated greeting export.","analysis":"One bounded overwrite is proposed.","assumptions":[],"proposedEdits":[],"validationFiles":["src/index.mjs"],"risks":[],"requiresPolicyEvaluation":false,"requiresKcp":false,"requiresHumanApproval":true,"proposalAuthorizesExecution":false,"status":"proposed","recommendedNextAction":"review_proposal"},"warnings":[],"errors":[],"limitations":["Engineering Brain proposes; it never authorizes or executes edits."],"usage":{"inputTokens":100,"outputTokens":200},"startedAt":"2026-07-11T00:00:00.000Z","completedAt":"2026-07-11T00:00:01.000Z","recommendedNextAction":"review_proposal"}
